{
  "schema_version": "1.0",
  "meter": {
    "pos": [
      0.0,
      5.0,
      0.0
    ],
    "wall_id": "side",
    "plus_minus_ft": 0.1
  },
  "walls": [
    {
      "id": "side",
      "baseline": [
        [
          -20.0,
          0.0
        ],
        [
          24.0,
          0.0
        ]
      ],
      "plus_minus_ft": 0.1
    }
  ],
  "objects": [
    {
      "type": "gas_meter",
      "wall_id": "side",
      "span_ft": [
        -6.0,
        -5.0
      ],
      "bottom_ft": 0.5,
      "top_ft": 2.5,
      "source": "tap",
      "plus_minus_ft": 0.1,
      "footprint": [
        [
          -6.0,
          0.0
        ],
        [
          -5.0,
          0.0
        ],
        [
          -5.0,
          1.0
        ],
        [
          -6.0,
          1.0
        ]
      ]
    },
    {
      "type": "window",
      "wall_id": "side",
      "span_ft": [
        -14.0,
        -11.0
      ],
      "bottom_ft": 3.0,
      "top_ft": 7.0,
      "attrs": {
        "operable": true
      },
      "source": "tap",
      "plus_minus_ft": 0.1
    }
  ],
  "ground": [
    {
      "type": "mulch",
      "polygon": [
        [
          -40.0,
          0.0
        ],
        [
          40.0,
          0.0
        ],
        [
          40.0,
          4.0
        ],
        [
          -40.0,
          4.0
        ]
      ],
      "plus_minus_ft": 0.1
    },
    {
      "type": "lawn",
      "polygon": [
        [
          -40.0,
          4.0
        ],
        [
          40.0,
          4.0
        ],
        [
          40.0,
          20.0
        ],
        [
          -40.0,
          20.0
        ]
      ],
      "plus_minus_ft": 0.1
    }
  ],
  "overheads": [],
  "facing": [
    {
      "wall_id": "side",
      "span_ft": [
        -20.0,
        24.0
      ],
      "depth_ft": 16.0,
      "plus_minus_ft": 0.2
    }
  ],
  "coverage": {
    "ends": {
      "left": {
        "kind": "limit"
      },
      "right": {
        "kind": "limit"
      }
    },
    "observed": [
      {
        "band": "wall",
        "span_ft": [
          -20.0,
          30.0
        ]
      },
      {
        "band": "ground",
        "span_ft": [
          -20.0,
          30.0
        ],
        "out_ft": 20.0
      },
      {
        "band": "overhead",
        "span_ft": [
          -20.0,
          30.0
        ]
      },
      {
        "band": "facing",
        "span_ft": [
          -20.0,
          30.0
        ]
      }
    ]
  }
}
