{
  "schema_version": "1.0",
  "meter": {
    "pos": [
      0.0,
      5.0,
      0.0
    ],
    "wall_id": "side",
    "plus_minus_ft": 0.1
  },
  "walls": [
    {
      "id": "side",
      "baseline": [
        [
          -3.0,
          0.0
        ],
        [
          9.0,
          0.0
        ]
      ],
      "plus_minus_ft": 0.1
    }
  ],
  "objects": [],
  "ground": [
    {
      "type": "mulch",
      "polygon": [
        [
          -40.0,
          0.0
        ],
        [
          40.0,
          0.0
        ],
        [
          40.0,
          4.0
        ],
        [
          -40.0,
          4.0
        ]
      ],
      "plus_minus_ft": 0.1
    },
    {
      "type": "lawn",
      "polygon": [
        [
          -40.0,
          4.0
        ],
        [
          40.0,
          4.0
        ],
        [
          40.0,
          20.0
        ],
        [
          -40.0,
          20.0
        ]
      ],
      "plus_minus_ft": 0.1
    }
  ],
  "overheads": [],
  "facing": [
    {
      "wall_id": "side",
      "span_ft": [
        -3.0,
        9.0
      ],
      "depth_ft": 16.0,
      "plus_minus_ft": 0.2
    }
  ],
  "coverage": {
    "ends": {
      "left": {
        "kind": "limit"
      },
      "right": {
        "kind": "unexplored"
      }
    },
    "observed": [
      {
        "band": "wall",
        "span_ft": [
          -20.0,
          9.0
        ]
      },
      {
        "band": "ground",
        "span_ft": [
          -20.0,
          9.0
        ],
        "out_ft": 20.0
      },
      {
        "band": "overhead",
        "span_ft": [
          -20.0,
          9.0
        ]
      },
      {
        "band": "facing",
        "span_ft": [
          -20.0,
          9.0
        ]
      }
    ]
  }
}
